id,ups,downs,upvote_ratio,subreddit,title,score,created_utc,url,selftext
1iv1hsg,152,0,0.92,wallstreetbets,"Weekend Discussion Thread for the Weekend of February 21, 2025",152,1740171451.0,https://www.reddit.com/r/wallstreetbets/comments/1iv1hsg/weekend_discussion_thread_for_the_weekend_of/,This post contains content not supported on old Reddit. [Click here to view the full post](https://sh.reddit.com/r/wallstreetbets/comments/1iv1hsg)
1iusm7y,218,0,0.97,wallstreetbets,Weekly Earnings Thread 2/24 - 2/28,218,1740149357.0,https://i.redd.it/4rdzmrkg9ike1.jpeg,
1ivnwgd,19940,0,0.93,wallstreetbets,Asked my 3 y/o to draw something about his Papa. What does this mean?,19940,1740245056.0,https://i.redd.it/quu6klf06qke1.jpeg,
1iwapg4,207,0,0.89,wallstreetbets,Smci secured 700M est at $61.06 per share,207,1740319059.0,https://www.reddit.com/r/wallstreetbets/comments/1iwapg4/smci_secured_700m_est_at_6106_per_share/,"Looks like they got some bigger bag holders.

https://finance.yahoo.com/news/super-micro-secures-700m-debt-171325550.html

Feb 21 - Super Micro Computer Inc. (SMCI, Financial) performs a strategic move by issuing $700 million in convertible senior notes. Super Micro Computer finalized the 2.25% convertible senior notes due 2028 with unsecured maturity on July 15, 2028, though the notes become redeemable before term through redemption or conversion or sukuk repurchase. Interest payments for the notes will begin in the first half of July 2025. Super Micro Computer Inc. intends to allocate the funds generated from its $700 million note issuance for corporate expenses, which include building operational working capital to sustain future growth initiatives.

Warning! GuruFocus has detected 5 Warning Signs with SMCI.

The notes provide noteholders with the option of redemption following March 1, 2026, according to the indenture provisions, while a fundamental change in the company entitles them to demand a repurchase. The debt-to-equity rate equals 16.3784 shares for every $1000 of the original principal and suggests each share holds a price of $61.06 yet."
1iw1p5b,943,0,0.98,wallstreetbets,no end in sight…,943,1740284135.0,https://i.redd.it/stg36918etke1.jpeg,
